{
  "assurance_binding": "3d1018b0cf6bb66fbc3faf6750ab97066c4043dd8021414b569d17183bff326d",
  "controls": [
    {
      "assessment": "partial",
      "attestation": "not_evaluated",
      "content_integrity": "not_evaluated",
      "control_id": "DSCB-L1-REQ-001",
      "coverage": "partial",
      "custody": "not_evaluated",
      "decision_context": "mainline",
      "effective_level": "unverified",
      "evidence": [
        {
          "attestation": "not_evaluated",
          "content_integrity": "pass",
          "custody": "not_evaluated",
          "effective_level": "integrity_verified",
          "evidence_refs": [
            "source/junit.xml",
            "runtime/junit.xml",
            "repository/quality/traceability.json"
          ],
          "evidence_type": "requirements_traceability_records",
          "freshness": {
            "evaluated_at": "2026-09-17T15:39:42.810248Z",
            "maximum_age_seconds": null,
            "policy_id": "freshness-control-evidence-commit-bound",
            "policy_status": "provisional",
            "policy_version": "0.1.0",
            "produced_at": "2026-09-17T15:38:49Z",
            "reason": "Evidence is bound to the centrally verified immutable subject.",
            "result": "pass"
          },
          "provenance": "pass",
          "replay": "not_evaluated",
          "required": true,
          "status": "present"
        },
        {
          "attestation": "not_evaluated",
          "content_integrity": "not_evaluated",
          "custody": "not_evaluated",
          "effective_level": "unverified",
          "evidence_refs": [],
          "evidence_type": "unmet_control_evidence",
          "freshness": {
            "evaluated_at": "2026-09-17T15:39:42.810248Z",
            "policy_id": "freshness-control-evidence-commit-bound",
            "policy_status": "provisional",
            "policy_version": "0.1.0",
            "produced_at": null,
            "reason": "Freigegebene Systemanforderungen und vollständige Abdeckung aller Komponenten nachweisen.",
            "result": "not_evaluated"
          },
          "provenance": "not_evaluated",
          "replay": "not_evaluated",
          "required": true,
          "status": "missing"
        }
      ],
      "freshness": {
        "evaluated_at": "2026-09-17T15:39:42.810248Z",
        "policy_id": "freshness-control-evidence-commit-bound",
        "policy_status": "provisional",
        "policy_version": "0.1.0",
        "produced_at": null,
        "reason": "Freigegebene Systemanforderungen und vollständige Abdeckung aller Komponenten nachweisen.",
        "result": "not_evaluated"
      },
      "missing_scope": [
        "Freigegebene Systemanforderungen und vollständige Abdeckung aller Komponenten nachweisen."
      ],
      "provenance": "not_evaluated",
      "replay": "not_evaluated",
      "subject_binding": "commit"
    },
    {
      "assessment": "partial",
      "attestation": "not_evaluated",
      "content_integrity": "not_evaluated",
      "control_id": "DSCB-L1-REQ-002",
      "coverage": "partial",
      "custody": "not_evaluated",
      "decision_context": "mainline",
      "effective_level": "unverified",
      "evidence": [
        {
          "attestation": "not_evaluated",
          "content_integrity": "pass",
          "custody": "not_evaluated",
          "effective_level": "integrity_verified",
          "evidence_refs": [
            "platform/commit.json",
            "platform/pulls.json"
          ],
          "evidence_type": "commit_history",
          "freshness": {
            "evaluated_at": "2026-09-17T15:39:42.810248Z",
            "maximum_age_seconds": null,
            "policy_id": "freshness-control-evidence-commit-bound",
            "policy_status": "provisional",
            "policy_version": "0.1.0",
            "produced_at": "2026-09-17T15:38:49Z",
            "reason": "Evidence is bound to the centrally verified immutable subject.",
            "result": "pass"
          },
          "provenance": "pass",
          "replay": "not_evaluated",
          "required": true,
          "status": "present"
        },
        {
          "attestation": "not_evaluated",
          "content_integrity": "not_evaluated",
          "custody": "not_evaluated",
          "effective_level": "unverified",
          "evidence_refs": [],
          "evidence_type": "unmet_control_evidence",
          "freshness": {
            "evaluated_at": "2026-09-17T15:39:42.810248Z",
            "policy_id": "freshness-control-evidence-commit-bound",
            "policy_status": "provisional",
            "policy_version": "0.1.0",
            "produced_at": null,
            "reason": "Organisatorische VCS-Freigabe und benötigte Review-Nachweise separat belegen; kein unabhängiges Review abgeleitet.",
            "result": "not_evaluated"
          },
          "provenance": "not_evaluated",
          "replay": "not_evaluated",
          "required": true,
          "status": "missing"
        }
      ],
      "freshness": {
        "evaluated_at": "2026-09-17T15:39:42.810248Z",
        "policy_id": "freshness-control-evidence-commit-bound",
        "policy_status": "provisional",
        "policy_version": "0.1.0",
        "produced_at": null,
        "reason": "Organisatorische VCS-Freigabe und benötigte Review-Nachweise separat belegen; kein unabhängiges Review abgeleitet.",
        "result": "not_evaluated"
      },
      "missing_scope": [
        "Organisatorische VCS-Freigabe und benötigte Review-Nachweise separat belegen; kein unabhängiges Review abgeleitet."
      ],
      "provenance": "not_evaluated",
      "replay": "not_evaluated",
      "subject_binding": "commit"
    },
    {
      "assessment": "gap",
      "attestation": "not_evaluated",
      "content_integrity": "not_evaluated",
      "control_id": "DSCB-L1-REQ-003",
      "coverage": "missing",
      "custody": "not_evaluated",
      "decision_context": "mainline",
      "effective_level": "unverified",
      "evidence": [
        {
          "attestation": "not_evaluated",
          "content_integrity": "pass",
          "custody": "not_evaluated",
          "effective_level": "integrity_verified",
          "evidence_refs": [
            "platform/protection.json",
            "platform/rules.json"
          ],
          "evidence_type": "branch_protection_configuration",
          "freshness": {
            "age_seconds": 53,
            "evaluated_at": "2026-09-17T15:39:42.810248Z",
            "maximum_age_seconds": 86400,
            "policy_id": "freshness-repository-configuration-24h",
            "policy_status": "provisional",
            "policy_version": "0.1.0",
            "produced_at": "2026-09-17T15:38:49Z",
            "reason": "Evidence age 53s is within the provisional maximum 86400s.",
            "result": "pass"
          },
          "provenance": "pass",
          "replay": "not_evaluated",
          "required": true,
          "status": "present"
        },
        {
          "attestation": "not_evaluated",
          "content_integrity": "not_evaluated",
          "custody": "not_evaluated",
          "effective_level": "unverified",
          "evidence_refs": [],
          "evidence_type": "unmet_control_evidence",
          "freshness": {
            "evaluated_at": "2026-09-17T15:39:42.810248Z",
            "policy_id": "freshness-repository-configuration-24h",
            "policy_status": "provisional",
            "policy_version": "0.1.0",
            "produced_at": null,
            "reason": "Vollständige Schutz- und Bypass-Regeln lesen und Direktänderungsverbot bewerten. API-Zugriff allein beweist keinen Schutz.",
            "result": "not_evaluated"
          },
          "provenance": "not_evaluated",
          "replay": "not_evaluated",
          "required": true,
          "status": "missing"
        }
      ],
      "freshness": {
        "evaluated_at": "2026-09-17T15:39:42.810248Z",
        "policy_id": "freshness-repository-configuration-24h",
        "policy_status": "provisional",
        "policy_version": "0.1.0",
        "produced_at": null,
        "reason": "Vollständige Schutz- und Bypass-Regeln lesen und Direktänderungsverbot bewerten. API-Zugriff allein beweist keinen Schutz.",
        "result": "not_evaluated"
      },
      "missing_scope": [
        "Vollständige Schutz- und Bypass-Regeln lesen und Direktänderungsverbot bewerten. API-Zugriff allein beweist keinen Schutz."
      ],
      "provenance": "not_evaluated",
      "replay": "not_evaluated",
      "subject_binding": "repository_state"
    },
    {
      "assessment": "findings",
      "attestation": "not_evaluated",
      "content_integrity": "pass",
      "control_id": "DSCB-L1-REQ-004",
      "coverage": "complete",
      "custody": "not_evaluated",
      "decision_context": "mainline",
      "effective_level": "integrity_verified",
      "evidence": [
        {
          "attestation": "not_evaluated",
          "content_integrity": "pass",
          "custody": "not_evaluated",
          "effective_level": "integrity_verified",
          "evidence_refs": [
            "source/bandit.json",
            "source/ruff.json"
          ],
          "evidence_type": "static_code_analysis_reports",
          "freshness": {
            "evaluated_at": "2026-09-17T15:39:42.810248Z",
            "maximum_age_seconds": null,
            "policy_id": "freshness-control-evidence-commit-bound",
            "policy_status": "provisional",
            "policy_version": "0.1.0",
            "produced_at": "2026-09-17T15:38:49Z",
            "reason": "Evidence is bound to the centrally verified immutable subject.",
            "result": "pass"
          },
          "provenance": "pass",
          "replay": "not_evaluated",
          "required": true,
          "status": "present"
        }
      ],
      "freshness": {
        "evaluated_at": "2026-09-17T15:39:42.810248Z",